{
  "args": {
    "context": {
      "epoch": "627",
      "network": "mainnet",
      "producer_txs": {
        "1ef2797c28a7679ca8e62693642513a44bed07bc37cdef73d4cd29956b4f83a5": {
          "source": "koios.tx_cbor",
          "tx_cbor": "84a90082825820d43c46cd4a64d65b066b6a7c553889d995edf4b83d7fe89df923a84874a949400082582047c282224d2b53f35217d6a20260c90d6686aa12678241fd2ccdc828cd4592e9000183a300581d7148994b529751b4b5565949a6c48413857b22ec91ec409c71c70705e101821a0012593aa1581c48994b529751b4b5565949a6c48413857b22ec91ec409c71c70705e1a144000de14001028201d818582258204170e1305df71c994a3b45af7b57a02db8308b54b6d0ac354592ef51abcfbf6c82581d61baee00f074cb8b9c077c944981e45829bf13d50daecada0235cf8c14821a000f8548a1581c48994b529751b4b5565949a6c48413857b22ec91ec409c71c70705e1a144000643b00182581d61baee00f074cb8b9c077c944981e45829bf13d50daecada0235cf8c141a05afa28a021a00036dcf09a1581c48994b529751b4b5565949a6c48413857b22ec91ec409c71c70705e1a244000643b00144000de140010b58202f01532891b5c64979a20d359f55a5b10e252baf9d9b7c4840643b3ce826edee0d8182582047c282224d2b53f35217d6a20260c90d6686aa12678241fd2ccdc828cd4592e9001082581d61baee00f074cb8b9c077c944981e45829bf13d50daecada0235cf8c141a02f5cbc9111a000524b712818258208607bbe5446ba2eea0620e7f2ed2da5e9e1746c7deefdc22bc3cf32ff4fb3f1e00a200818258208b7f96bd237625f1d36315b7d7d7e12d29a872470073d56777ecd170772a16af5840ffca5d3a438808eeff1ec7f43a84bbd54f19e813a727288c21faf72ee36c9e4d1af35ef9b6b80cf1f59c2a7b4a42e34f2a76ea7e8b27ec045e184cc60c3a97060581840100d87980821a0001b16e1a022cd1d5f5f6"
        },
        "42ceabd168faa7e7bbe10d8e72e6ba0e71886bf3537ea88bd098782e1df1c1e9": {
          "source": "koios.tx_cbor",
          "tx_cbor": "84aa0081825820764174262bcf0254de6ad51b7828f8619f28bda7478bf851dce7a11937fb02cd030183a300581d71193ee65211bb3b4e0ea5f751f415269355a650e2e3706f625cdf1a4b01821a0014faaaa1581c193ee65211bb3b4e0ea5f751f415269355a650e2e3706f625cdf1a4ba14001028201d818584ed8799fd8799f4c4345522f4c512d4144412f331b0000019dc5a38beed8799f1a607856091a77359400ffffd8799f581c3c12f6735ef87655c5b27bced3f828d857d0a27fd20f2cda18ebf2fbffffa300581d71193ee65211bb3b4e0ea5f751f415269355a650e2e3706f625cdf1a4b01821a0015a306a1581c193ee65211bb3b4e0ea5f751f415269355a650e2e3706f625cdf1a4ba14001028201d8185858d8799fd8799f4e4345522f494e44592d4144412f331b0000019dc5a38bfdd8799f1b000000017463032b1b00000002540be400ffffd8799f581c3c12f6735ef87655c5b27bced3f828d857d0a27fd20f2cda18ebf2fbffff82581d613c12f6735ef87655c5b27bced3f828d857d0a27fd20f2cda18ebf2fb1b00000001a222acd9021a00041a8d07582008b6400fa8664712dcf5cd77801b2b40752f5ca10559e9ac5746c0073a931e6e09a1581c193ee65211bb3b4e0ea5f751f415269355a650e2e3706f625cdf1a4ba140020b58202572df674d0f4d5f83ed52f53c1c2745cf88f37c24b94681e0c86015648c52580d81825820764174262bcf0254de6ad51b7828f8619f28bda7478bf851dce7a11937fb02cd031082581d613c12f6735ef87655c5b27bced3f828d857d0a27fd20f2cda18ebf2fb1b00000001a24b3d42111a000627d412828258201ef2797c28a7679ca8e62693642513a44bed07bc37cdef73d4cd29956b4f83a50082582087daf43c764260d9ad00342fcb0d444c15752c9215f43c6b8e74189e7ba9939700a2008182582019bea973f87d38c414515d4f7f3564ccfc0a713e877270a5c8fe2aa098a5e9055840b4c4bc586f5c80346932c564ad0409d891d903c5048655ee0729b2832eae77a1b3a070c3a259f858b0eca6ca16d6d1d0d9db5b768622c2bec629b5bb5a17800f0581840100d8799f9f5840e428dd8059699ab425e9112d4f382e1f48b5cba699c5269f428dc10421d3a4d94704cd055986f5128ec9478720b8b16373294970f151bf0b8fad1e794539a80b5840285b1a9742c0cb5cb8343bb2fe6c7480e9163eff8f6422f2e69f37884b25fab9b592f3a437c4487928cca2ec909668446c76eec5b455c0fe55e8edd04acfd003ffff821a0003a1371a0be00da3f5a11904ca837837557365206f7261636c65206461746120617420796f7572206f776e207269736b3a2068747470733a2f2f6f72636661782e696f2f746f73a2626964782f75726e3a6f72636661783a31643966343538312d313663662d346464612d626663612d36636638626235373133663463737263783775726e3a617277656176653a6932664e76346b73636169686551597a3234664f6e51426243316d4966304c324675456b484c4856425f41a2626964782f75726e3a6f72636661783a64333130383930352d306262632d343834622d393662382d33333461666630386537306363737263783775726e3a617277656176653a6d4c3158717641676a5468546934436e666d686a6d476e445a32545a6958492d72685761756375666e3759"
        },
        "87daf43c764260d9ad00342fcb0d444c15752c9215f43c6b8e74189e7ba99397": {
          "source": "koios.tx_cbor",
          "tx_cbor": "84a30081825820f9647c85757a76c3e903b7f840243c9e5afff88bcd3a70e23f36d2a5f2ea4abb000182a400581d616bf886de6f0eeacb26dc985bb2590d257849debd8028eb3a10ee2c1e011a0096ff50028201d8184342667303d818590822820259081d59081a01000033232323232323222253232323233300830013009375400a264a666012646464a666018600a601a6ea80044c8c8c8c8c8c8c8c94ccc050c034c054dd50090991919299980d180e80209919299980c980a0010a99980c99b87332300100122533301e0011480004cdc02400466004004604200200a0022646464660020026466600200201a012444a666044004297ae013232533302400314bd700998129998109919191919191919299981499b8748010c0a8dd50018992999815181318159baa0031533302a3375e00402226464a66605e60640042a66605866ebcdd38009ba701213233372a0306e50dd9981918179baa00400c533302c3025302d3754006264646464a666066606c00426464932999818981518191baa0021323253330363039002149858dd7181b80098199baa0021653330303029303137540062646464646464a66607260780042930b181d000981d0011bad30380013038002375c606c00260646ea800c5858c0d0004c0d0008c0c8004c0b8dd50018b0b0b1bac30300013030323300100100722533302f00114bd70099199911191980080080191299981a80088018991981b9ba733037375200c6606e60680026606e606a00297ae03300300330390023037001375c605c0026eacc0bc004cc00c00cc0cc008c0c40045858c0b8c0acdd50018b181698151baa302d006302c302d002302b001302b00237566052002605200260486ea800cdd71813001a60103d87a80004c0103d879800033300500500130270033026003302400222533302000114a2264a66603c66e212000301f375460460042660060060022940c08c004cc078dd48071980f1ba90033301e4c010101004bd7019ba548008cc074dd4806a5eb805858dd6980d0011bae301800116301b00332323300100100922533301b001161323232533301b301732533301c3018301d37540022900009bad3021301e375400264a6660386030603a6ea8004530103d87a80001323300100137566044603e6ea8008894ccc084004530103d87a800013232323253330223372291104000de14000002153330223371e910104000de140000021301c33026375000297ae014c0103d87a8000133006006003375a60460066eb8c084008c094008c08c004cc028dd598100010030a99980d99b8748010c070dd500089bae3020301d37540022c26600a00a006603e6040002603e60366ea8c078c07cc06cdd5180f001180f0009bae301a301737540286eb0c064c058dd5009099299980c180d8010a99980a99b88375a602e00290000991980080080311299980d0008a5113253330183375e6e98cc018dd5980e980f180d1baa301d00200c4c101a00013300300300114a0603a0022c2c60320026600264660020026eacc064c068c068014894ccc06000452f5bded8c0264646464a66603266e452201000021533301930140021003100513301d337606ea4008dd3000998030030019bab301a003375c60300046038004603400200e4464a66602a6022602c6ea800452f5bded8c026eacc068c05cdd50009980180100091191980080080191299980c0008a6103d87a800013232323253330193372200e0042a66603266e3c01c0084c04ccc074dd3000a5eb80530103d87a8000133006006003375660340066eb8c060008c070008c068004dd6180a800980a8011bac30130013013300f37540066eb8c044c038dd50008b18081808801180780098059baa00614984d958c94ccc024c0080044c8c94ccc038c0440084c926323300100100222533301000114984c8cc00c00cc050008dd718090008b1bac300f001300b375400e2a666012600a0022a66601860166ea801c52616163009375400c264644a66601664646464646464a666024601c60266ea80184c8c94ccc050c034c054dd500089919299980b1809180b9baa00213232533301b301e00215333018337106eb4c06800520001323300100100822533301d00114a0264a66603666e3cdd718100010030a5113300300300130200011616301c001325333017301330183754002297adef6c6013756603860326ea8004c8c8cc004004c8cc004004024894ccc07400452f5bded8c0264646464a66603c66e45221000021533301e301900210031005133022337606ea4008dd3000998030030019bab301f003375c603a0046042004603e00244a6660380022980103d87a8000132323232533301d3372200e0042a66603a66e3c01c0084c05ccc084dd3000a5eb80530103d87a80001330060060033756603c0066eb8c070008c080008c078004dd7180d980c1baa00216375c6034602e6ea8c068c06cc05cdd5009980c980b1baa30193016375460326034602c6ea8c064c058dd50008b191980080080311299980c0008a60103d87a80001323253330173375e603860326ea80080144c044cc06c0092f5c026600800800260380046034002602e60286ea801858dd6180b180b980b980b980b8011bab3015001301530153015301500237586026002601e6ea8c048008c044c048004c034dd50008a4c26cac64a666014600660166ea800454ccc034c030dd50008a4c2c2c601c60166ea80194ccc020c004c024dd5003099191919299980798090010991924ca66601a600c601c6ea80084c8c94ccc048c05400852616375c6026002601e6ea8008594ccc030c014c034dd50018991919191919299980a980c0010a4c2c602c002602c0046eb4c050004c050008dd7180900098071baa003161630100013010002300e001300a375400c2c6e1d2000374a90001b8f488100370e90012b9a5573aaae7955cfaba05742ae89300122d8799f581c48994b529751b4b5565949a6c48413857b22ec91ec409c71c70705e1ff000182581d61f8632d33365e6be041f29bfdc73bfc645cb1b338afdb3020275e88f61a00d7518f021a0003ef99a10081825820b00e807c54995cc10afc0aa73b69ecbc592f13caa8d4b818d708623d98bd1e1d58406ee98a547ce5bb110d26f7c3f85f22d864a8ba251a8799cff7caa7f5443e20217074b6a7befc3de099db89abd3fe97ada1984d0334e5adbb150d8052856ea30cf5f6"
        }
      },
      "protocol_parameters": {
        "collateralPercentage": 150,
        "committeeMaxTermLength": 146,
        "committeeMinSize": 7,
        "costModels": {
          "PlutusV1": [
            100788,
            420,
            1,
            1,
            1000,
            173,
            0,
            1,
            1000,
            59957,
            4,
            1,
            11183,
            32,
            201305,
            8356,
            4,
            16000,
            100,
            16000,
            100,
            16000,
            100,
            16000,
            100,
            16000,
            100,
            16000,
            100,
            100,
            100,
            16000,
            100,
            94375,
            32,
            132994,
            32,
            61462,
            4,
            72010,
            178,
            0,
            1,
            22151,
            32,
            91189,
            769,
            4,
            2,